{"schema":"geometry.step_topology.apply_hierarchy.result.a0","state":{"session":{"session_handle":"gts_1111111111111111111111111111111111111111111111111111111111111111","generation":10},"edit_journal_revision":1,"accounted_string_bytes":256,"estimated_resident_bytes":8192},"hierarchy":{"hierarchy_revision":1,"source_brep_sha256":"bbbbbbbbbbbbbbbbbbbbbbbbbbbbbbbbbbbbbbbbbbbbbbbbbbbbbbbbbbbbbbbb","nodes":[{"authored_id":"wn.geometer.research.product.box","revision":1,"kind":"product","name":"Box","source_kind":"definition","source_handle":"gtt_2222222222222222222222222222222222222222222222222222222222222222"},{"authored_id":"wn.geometer.research.assembly.root","revision":1,"kind":"assembly","name":"Root"}],"occurrences":[{"authored_id":"wn.geometer.research.occurrence.box","revision":1,"child_authored_id":"wn.geometer.research.product.box","parent_assembly_authored_id":"wn.geometer.research.assembly.root","transform":[1,0,0,0,0,1,0,0,0,0,1,0]}]},"diagnostics":[]}
