{"schema":"geometry.step_topology.apply_hierarchy.result.a0","state":{"session":{"session_handle":"gts_1111111111111111111111111111111111111111111111111111111111111111","generation":10},"edit_journal_revision":1,"accounted_string_bytes":256,"estimated_resident_bytes":8192},"hierarchy":{"hierarchy_revision":1,"source_brep_sha256":"bbbbbbbbbbbbbbbbbbbbbbbbbbbbbbbbbbbbbbbbbbbbbbbbbbbbbbbbbbbbbbbb","nodes":[{"authored_id":"wn.geometer.research.assembly.a","revision":1,"kind":"assembly","name":"A"},{"authored_id":"wn.geometer.research.assembly.b","revision":1,"kind":"assembly","name":"B"}],"occurrences":[{"authored_id":"wn.geometer.research.occurrence.a-b","revision":1,"child_authored_id":"wn.geometer.research.assembly.b","parent_assembly_authored_id":"wn.geometer.research.assembly.a","transform":[1,0,0,0,0,1,0,0,0,0,1,0]},{"authored_id":"wn.geometer.research.occurrence.b-a","revision":1,"child_authored_id":"wn.geometer.research.assembly.a","parent_assembly_authored_id":"wn.geometer.research.assembly.b","transform":[1,0,0,0,0,1,0,0,0,0,1,0]}]},"diagnostics":[]}
